A Alma e a Gente	2003	History
A Band Apart	2014	Comedy
A Beautiful Affair	2012	Drama
A Beetle Called Derek	1990	Family
A Bender Abroad	2013	Documentary
A Better Life with Charles Nieman	2010	Family
A Big Country	1968	News
A Bike Is Born	2002	Documentary
A Billion to One	2015	Drama
A Biography of America	2000	History
A Bit Much	2014	Comedy
A Bit Much	2014	Drama
A Bit Much	2014	Romance
A Bit of Fry and Laurie	1987	Comedy
A Bit of a Do	1989	Comedy
A Bit of a Do	1989	Drama
A Bite of China II	2014	Documentary
A Brand New Life	1989	Comedy
A Brew Hope	2012	Comedy
A Brilliant Road Trip	2012	Documentary
A Brit and a Broad	2015	Documentary
A Brother for Joe	1961	Thriller
A Brush with the Mersey	2004	Documentary
A Bunch of Fives	1977	Drama
A Bunch of Fives	1977	Family
A Bunch of Munsch	1991	Animation
A Bunch of Munsch	1991	Family
A CARography	2002	Documentary
A Cabbie Abroad	2014	Documentary
A Cappella	2016	Comedy
A Cappella	2016	Drama
A Cappella	2016	Music
A Car Called Wanda	2012	Comedy
A Car for Africa	1987	Documentary
A Cara do Futuro	2016	Documentary
A Casa Do Playhouse Disney	2009	Comedy
A Casa Do Playhouse Disney	2009	Family
A Casa Do Playhouse Disney	2009	Musical
A Casa Nostra	2015	Family
A Casa da Conexa	2013	Comedy
A Casa das Sete Mulheres	2003	Drama
A Casa das Sete Mulheres	2003	History
A Casa das Sete Mulheres	2003	Romance
A Casa das Sete Mulheres	2003	War
A Casa do Disney Junior	2011	Comedy
A Casa do Disney Junior	2011	Family
A Casa do Disney Junior	2011	Musical
A Casa do Disney Junior	2011	Short
A Casa do Herman	2016	Comedy
A Casa do Tio Carlos	1993	Family
A Case for the Court	1960	Documentary
A Case for the Court	1960	Drama
A Castle and Sixpence	1954	Adventure
A Century of Women	1994	Documentary
A Century of Women	1994	Drama
A Century of Women	1994	History
A Certain Justice	1998	Crime
A Certain Justice	1998	Drama
A Certain Justice	1998	Mystery
A Chance of Thunder	1961	Thriller
A Chance to Sit Down	1981	Drama
A Change in Degree	2011	Comedy
A Change of Face	2009	Documentary
A Child Against All Odds	2006	Documentary
A Choice of Coward	1964	Drama
A Chopper Is Born	2002	Documentary
A Christmas Night with the Stars	1958	Comedy
A Christmas Night with the Stars	1958	Music
A Church to Yourself	1979	Documentary
A Church to Yourself	1979	History
A Class Act	2014	Comedy
A Class by Himself	1971	Comedy
A Class of Cool	2015	Comedy
A Clear Word from Mud Creek	2006	Family
A Closer Look	1991	Biography
A Closer Look	1991	Documentary
A Comicbook Orange	2007	Biography
A Comicbook Orange	2007	News
A Confeitaria	2011	Family
A Copa do Mundo no Recife	2015	Documentary
A Country Practice	1981	Drama
A Country Practice	1981	Romance
A Country Practice	1994	Drama
A Couple of Astronauts	2014	Animation
A Couple of Joes	1949	Comedy
A Couple of Joes	1949	Music
A Crazy Leo Show	2013	Comedy
A Crime to Remember	2013	Crime
A Crime to Remember	2013	Documentary
A Cruz y a espada	1992	Documentary
A Cunhada	2006	Drama
A Cura	2010	Drama
A Cura	2010	History
A Cura	2010	Mystery
A Cure for Dead	2011	Action
A Cure for Dead	2011	Comedy
A Cure for Dead	2011	Horror
A Current Affair	1971	News
A Current Affair	1986	News
A Dalmatians Point of View	2002	Adventure
A Dalmatians Point of View	2002	Comedy
A Dalmatians Point of View	2002	Family
A Dalmatians Point of View	2002	Short
A Dance to the Music of Time	1997	Drama
A Dangerous Life	1988	Crime
A Dangerous Life	1988	Documentary
A Dangerous Life	1988	Drama
A Dangerous Life	1988	History
A Dangerous Life	1988	Thriller
A Dare to Remember	2016	Action
A Dark Adapted Eye	1994	Crime
A Dark Adapted Eye	1994	Drama
A Dark Adapted Eye	1994	Mystery
A Dark Adapted Eye	1994	Thriller
A Dark Tale	2015	Action
A Dark Tale	2015	Drama
A Dark Tale	2015	Fantasy
A Data e o Feito	1982	History
A Date with Judy	1952	Comedy
A Dating Story	2000	Documentary
A Daughter Just Like You	2015	Drama
A Day for Nature	2008	Documentary
A Day in a Day Out	1997	Documentary
A Day in the Country	1997	Documentary
A Day in the Hustle	2014	Documentary
A Day in the Hustle	2014	Short
A Day in the Life Of	2016	Short
A Day in the Life of Mike Phelps	2012	Comedy
A Day in the Life of Young Robin Hood	2012	Action
A Day in the Life of Young Robin Hood	2012	Adventure
A Day in the Life of Young Robin Hood	2012	Family
A Day in the Life of Young Robin Hood	2012	Short
A Day in the Life	2010	Comedy
A Day in the Life	2011	Documentary
A Death in California	1985	Drama
A Decade On	2015	Comedy
A Demanda do R	1998	Animation
A Demanda do R	1998	Family
A Detective Housewife	2016	Action
A Detective Housewife	2016	Comedy
A Diarista	2003	Comedy
A Diary of Britain	1979	Documentary
A Different Country	2014	Documentary
A Different Life	2005	Family
A Different Spin with Mark Hoppus	2010	Music
A Different World	1987	Comedy
A Difficult Woman	1998	Drama
A Difficult Woman	1998	Mystery
A Diplomat in Japan	1992	Drama
A Disappeared Special	2014	Crime
A Dish a Day	2010	Family
A Division of Honorary Detectives	2017	Comedy
A Documentary of Life	2012	Comedy
A Documentary of Life	2012	Documentary
A Dominican Hitman	2013	Action
A Dose of Buckley	2009	Comedy
A Double Shot at Love	2008	Romance
A Drop of True Blood	2010	Drama
A Drop of True Blood	2010	Fantasy
A Drop of True Blood	2010	Horror
A Drop of True Blood	2010	Short
A Electra le sienta bien el luto	1986	Drama
A Escrava Isaura	2004	Drama
A Escrava Isaura	2004	Romance
A Escrita da Casa	1987	Biography
A Escrita da Casa	1987	History
A Esfera de Ki	1992	Family
A Family Man	1984	Drama
A Family at War	1970	Drama
A Family at War	1970	War
A Family for Joe	1990	Comedy
A Farewell to Arms	1966	Drama
A Fatal Inversion	1992	Thriller
A Favorita	2008	Drama
A Favorita	2008	Mystery
A Favorita	2008	Thriller
A Febre do Ouro Negro	2000	Drama
A Febre do Ouro Negro	2000	History
A Febre do Ouro Negro	2000	Romance
A Feira	1977	Comedy
A Ferreirinha	2004	Drama
A Ferro E Fogo	2003	Documentary
A Fertile Alternative	2011	Documentary
A Festa Continua	1983	Musical
A Fine Romance	1981	Comedy
A Fine Romance	1981	Romance
A Flame in the Wind	1964	Drama
A Flame in the Wind	1964	Romance
A Floresta Portuguesa	1983	Documentary
A Football Life	2011	Biography
A Football Life	2011	Sport
A Foreign Exchange Love	2014	Comedy
A Fork in Africa	2003	Documentary
A Fork in Asia	2000	Documentary
A Fork in Australia	1999	Documentary
A Fork in the Mediterranean	2005	Documentary
A Fortunate Life	1985	Biography
A Fortunate Life	1985	Drama
A Fortunate Life	1985	History
A Fortunate Life	1985	War
A Fortune Teller Told Me	2011	Documentary
A French Guy Named Saba	2013	Comedy
A Game of Darts	2015	Comedy
A Game of Murder	1966	Thriller
A Game of Soldiers	1984	Drama
A Garota da Moto	2016	Drama
A Gay and a Girl	2015	Comedy
A Generation at War	2014	Documentary
A Generation at War	2014	War
A Gifted Man	2011	Drama
A Gifted Man	2011	Fantasy
A Girl Named Zat	2013	Drama
A God Named Pablo	2010	Action
A God Named Pablo	2010	Comedy
A God Named Pablo	2010	Fantasy
A Grande Mentira	1958	Drama
A Great Welsh Adventure with Griff Rhys Jones	2014	Documentary
A Guerra dos Pintos	1999	Comedy
A Gurls Wurld	2010	Family
A Guy Walks Into a Bar	2011	Comedy
A Guy and a Girl	2002	Comedy
A Gypsy Life for Me	2011	Documentary
A Handful of Songs	1973	Music
A Handful of Thieves	1969	Drama
A Haunting We Will Go	1976	Family
A Haunting in Ravenswood	2014	Mystery
A Haunting	2005	Documentary
A Haunting	2005	History
A Haunting	2005	Horror
A Higher Education	2011	Documentary
A Higher Education	2011	Short
A History of Ancient Britain	2011	Documentary
A History of Art in Three Colours	2012	Documentary
A History of Black Achievement in America	2005	Documentary
A History of Black Achievement in America	2005	History
A History of Britain	2000	Documentary
A History of Britain	2000	History
A History of British Art	1996	Documentary
A History of Celtic Britain	2011	Documentary
A History of Christianity	2009	Documentary
A History of Film	2016	Documentary
A History of Horror with Mark Gatiss	2010	Documentary
A History of Scotland	2008	Documentary
A History of Scotland	2008	History
A History of Tyneside	2006	Documentary
A History of the World	2010	Documentary
A Hollywood Affair	2012	Comedy
A Hora da Liberdade	1999	Action
A Hora da Liberdade	1999	Drama
A Hora do Lecas	1989	Family
A Hora do Mico	2005	Comedy
A Horrorshow	2014	Horror
A Horseman Riding By	1978	Drama
A Hot Mess	2015	Comedy
A House Called Bell Tower	1960	Drama
A House for All Seasons	1983	Family
A Houseful of Plants	1987	Documentary
A Hundred Years of Us	2011	Documentary
A Hundred Years of Us	2011	History
A Impostora	2016	Comedy
A Impostora	2016	Drama
A Impostora	2016	Romance
A Industria Regionalizada	1980	Documentary
A Is for Aardvark	1954	Documentary
A Journey Through Aesthetic Realms	2005	History
A Journey Through Aesthetic Realms	2005	News
A Journey Through Asian Art	2014	Documentary
A Journey Through the Three Times Moving Trilogy	2015	Documentary
A Kalahari Family	2001	Documentary
A Kick Up the Eighties	1981	Comedy
A Killing on the Exchange	1987	Thriller
A Kind of Living	1988	Comedy
A Kind of Loving	1982	Drama
A Kind of Magic	2008	Animation
A Kind of Magic	2008	Family
A Kind of Magic	2008	Fantasy
A Kinda Sketchy Show	2013	Comedy
A Kings Life	2016	Drama
A LARP Story	2013	Comedy
A LARP Story	2013	Fantasy
A Laker Life	2014	Sport
A Land Looking West	1977	Documentary
A Laugh a Day	2013	Animation
A Laugh a Day	2013	Comedy
A Laugh a Day	2013	Short
A Laughing Matter	2013	Comedy
A Laurel and Hardy Cartoon	1966	Animation
A League of Their Own	1993	Comedy
A League of Their Own	1993	Sport
A League of Their Own	2010	Comedy
A League of Their Own	2010	Sport
A Legacy of Faith	2008	Family
A Legacy	1975	Drama
A Legitimate Television Show	2016	Comedy
A Lei de Murphy	2014	Comedy
A Lei e o Crime	2009	Action
A Lei e o Crime	2009	Crime
A Lena e o Carlos	1960	Comedy
A Life at Stake	1978	Drama
A Life in Pieces	1990	Comedy
A Life in Pieces	1990	Short
A Life of Bliss	1960	Comedy
A Life of Bliss	1960	Drama
A Life of Grime	1999	Documentary
A Life	2008	Documentary
A Liga	2010	Documentary
A Likely Lad	1990	Drama
A Likely Story	1987	Family
A Limey in the USA	2012	Documentary
A Little Advice	2016	Comedy
A Little Big Business	1963	Comedy
A Little Bit of Wisdom	1974	Comedy
A Little Curious	1998	Animation
A Little Curious	1998	Family
A Little Help	2014	Comedy
A Little Night Music	1978	Music
A Little Off	2016	Comedy
A Little Pain	2015	Drama
A Little Princess	1973	Drama
A Little Silver Trumpet	1980	Drama
A Loja do Camilo	1999	Comedy
A Loving Home	2011	Comedy
A Lua Me Disse	2005	Romance
A Magazine	1998	News
A Man Called Harry Brent	1965	Thriller
A Man Called Hawk	1989	Action
A Man Called Hawk	1989	Drama
A Man Called Intrepid	1979	Adventure
A Man Called Intrepid	1979	Drama
A Man Called Intrepid	1979	War
A Man Called Shenandoah	1965	Western
A Man Called Sloane	1979	Action
A Man Called Sloane	1979	Adventure
A Man Called Sloane	1979	Drama
A Man Dies	1964	Drama
A Man Walks Into a Bar	2014	History
A Man of Principals	2009	Comedy
A Man of our Times	1967	Drama
A Many Splintered Thing	2000	Comedy
A Many Splintered Thing	2000	Romance
A Marquesa de Vila Rica	1991	Comedy
A Married Man	1983	Drama
A Mask for Alexis	1959	Thriller
A Match Made in Heaven	2008	Documentary
A Matter of Degree	1960	Drama
A Menina Sem Qualidades	2013	Drama
A Message from God	2002	Animation
A Midsummer Theatre	1958	Drama
A Mind to Kill	1994	Crime
A Mind to Kill	1994	Drama
A Minority Report	2013	Comedy
A Minute of Self Defense	2013	News
A Minute with Stan Hooper	2003	Comedy
A Miss Mallard Mystery	2000	Adventure
A Miss Mallard Mystery	2000	Animation
A Miss Mallard Mystery	2000	Crime
A Miss Mallard Mystery	2000	Mystery
A Model Adventure	2014	Documentary
A Moment in Time	1979	Drama
A Moment to Talk	1982	Family
A Moody Christmas	2012	Comedy
A More Perfect Union	1987	Documentary
A More Perfect Union	2016	Documentary
A Moreninha	1959	Romance
A Morgadinha dos Canaviais	1990	Drama
A Movie Review	2012	Comedy
A Mulher do Prefeito	2013	Comedy
A Muralha	2000	Adventure
A Muralha	2000	Drama
A Musical World	1980	Drama
A Musical World	1980	Musical
A Nation in Reserve	2009	Documentary
A Nero Wolfe Mystery	2000	Action
A Nero Wolfe Mystery	2000	Drama
A Nero Wolfe Mystery	2000	Mystery
A New Day in Eden	1982	Drama
A New Kind of Family	1979	Comedy
A New York Love Affair	2013	Romance
A Nice Day at the Office	1972	Comedy
A Night at the Classic	2010	Comedy
A Night of Exploration	2013	Documentary
A Nos Amours	2008	Documentary
A Nos Amours	2008	Romance
A Onna E Onna	1997	Adult
A Outra Face da Lua	2000	Music
A Outra	2008	Drama
A Padroeira	2001	Action
A Padroeira	2001	Adventure
A Padroeira	2001	Drama
A Padroeira	2001	Romance
A Pang for Brasil	2014	Documentary
A Parcel of Rogues	1998	Documentary
A Parliament of Souls	1994	Documentary
A Passion for Angling	1993	Documentary
A Passion for Churches	2005	Documentary
A Passionate Woman	2010	Drama
A Path to Honor	2011	Documentary
A Peaceable Kingdom	1989	Drama
A Pedra do Reino	2007	Drama
A Pedra do Reino	2007	Fantasy
A Pedra do Reino	2007	History
A Pedra do Reino	2007	Music
A Pedra do Reino	2007	Romance
A Pera picada	2008	Comedy
A Perfect Hero	1991	Drama
A Perfect Hustle	2014	Action
A Perfect Hustle	2014	Crime
A Perfect Hustle	2014	Thriller
A Perfect Spy	1987	Thriller
A Perfect State	1997	Comedy
A Perfect World	2014	Comedy
A Personal Story	2002	Documentary
A Personal View	1988	Documentary
A Picture of Britain	2005	Documentary
A Picture of London	2012	Documentary
A Pin to See the Peepshow	1973	Drama
A Place Among the Undead	2016	Documentary
A Place Called Home	2006	Drama
A Place by the Sea	2004	Documentary
A Place in France	2002	Documentary
A Place in the Sun	1998	Documentary
A Place in the Sun	2000	Documentary
A Place in the World	1979	Drama
A Place of Execution	1953	Thriller
A Place to Call Home	2013	Drama
A Place to Hide	1976	Adventure
A Place to Hide	1976	Family
A Planet for the Taking	1985	Documentary
A Poor Gentleman	1965	Family
A Porta	1989	Family
A Portrait of Robert Runcie	1980	Documentary
A Prairie Home Companion with Garrison Keillor	1987	Family
A Present for Dickie	1969	Comedy
A Primera Hora	2007	Family
A Primera Hora	2007	News
A Prince Among Men	1997	Comedy
A Prison of Skin	2016	Thriller
A Problem Shared	2012	Comedy
A Produtora	2014	Comedy
A Puerta Abierta	2015	Documentary
A Pup Grows Up	2006	Family
A Question of Guilt	1980	Drama
A Question of Pop	2000	Music
A Question of Sport	1970	Sport
A Question of Sport	1989	Sport
A Question of TV	2001	Comedy
A Question of TV	2001	Family
A Quiet Conspiracy	1989	Thriller
A Racing Car Is Born	2002	Documentary
A Raging Calm	1974	Drama
A Recipe for Disaster	2016	Documentary
A Redheads Life	2015	Comedy
A Regra do Jogo	2015	Comedy
A Regra do Jogo	2015	Crime
A Regra do Jogo	2015	Drama
A Regra do Jogo	2015	Mystery
A Regra do Jogo	2015	Thriller
A Relevant Word	2008	Drama
A Respectable Trade	1998	Drama
A Roof Over My Head	1977	Comedy
A Roomful of Music	1965	Music
A Rough Guide to Torture	2006	Documentary
A Round with Pace	2002	Sport
A Royal Birthday	2006	Comedy
A Rubovian Legend	1955	Family
A Rumor of War	1980	Biography
A Rumor of War	1980	Drama
A Rumor of War	1980	War
A S K	2015	Comedy
A Scattering of Seeds	1998	Biography
A Scattering of Seeds	1998	Documentary
A Scattering of Seeds	1998	Drama
A Scattering of Seeds	1998	History
A Seaside Parish	2004	Documentary
A Season with Irish Referees	2014	Sport
A Season with Notre Dame Football	2015	Sport
A Second Proposal	2004	Romance
A Segunda Vez	2014	Drama
A Semana com Ronald Rios	2016	Comedy
A Sense of Guilt	1990	Drama
A Series of ONE	2015	Drama
A Series of Unfortunate Events	2016	Adventure
A Series of Unfortunate Events	2016	Drama
A Series of Unfortunate Events	2016	Family
A Series of Unfortunate People	2011	Comedy
A Set of Six	1990	Comedy
A Shared House	2015	Comedy
A Sharp Intake of Breath	1977	Comedy
A Shooting Vice	2013	Action
A Short History of Everything Else	2012	Comedy
A Short History of the Highrise	2013	Documentary
A Short from Vlad	2015	Comedy
A Shot at Glory	2008	Sport
A Shot at Love with Tila Tequila	2007	Romance
A Show Called Fred	1956	Comedy
A Single Girls Show	2012	Comedy
A Sipsirica	1980	Drama
A Skirt Through History	1994	Drama
A Slap on Titan	2014	Action
A Slap on Titan	2014	Animation
A Slap on Titan	2014	Comedy
A Small Problem	1987	Comedy
A Smiling Ghost Story	1999	Comedy
A Smiling Ghost Story	1999	Romance
A Soft Touch	1978	Comedy
A Sogra Que Deus Me Deu	1955	Comedy
A Solteirona	2013	Comedy
A Song for London	2006	Documentary
A Sort of Innocence	1986	Drama
A South American Journey with Jonathan Dimbleby	2011	Documentary
A Southern Gentleman Reads Amazon Reviews	2015	Comedy
A Spanish Legacy	1977	Documentary
A Special Relationship aka Une Relation Dangereuse	2016	Drama
A Spy at Evening	1981	Thriller
A Stab in the Dark	1992	Comedy
A Stand Up Mother	2011	Comedy
A Story with Me in It	2010	Documentary
A Story with Me in It	2012	Documentary
A Stranger in My Home	2013	Drama
A Stranger on the Hills	1970	Drama
A Study in Fear	2015	Comedy
A Study in Fear	2015	Horror
A Superhero Story	2011	Comedy
A TV Dante	1989	Drama
A Tale of Two Cities	1957	Drama
A Tale of Two Cities	1957	History
A Tale of Two Cities	1965	Drama
A Tale of Two Cities	1980	Drama
A Tale of Two Cities	1989	Drama
A Tale of Two Cities	1989	History
A Tale of Two Cities	1989	Romance
A Tale of Two Cities	1989	War
A Tale of Two Cities	2015	Documentary
A Tale of Two Rivers	1966	Music
A Taste for Blue Ribbons	1973	Drama
A Taste for Death	1988	Crime
A Taste for Death	1988	Drama
A Taste for Death	1988	Mystery
A Taste of Bachelorhood	1986	Drama
A Taste of China	1982	Documentary
A Taste of History	2008	History
A Taste of My Life	2006	Biography
A Taste of My Life	2006	Documentary
A Taste of Travel	2012	Documentary
A Taste of the World	2013	Adventure
A Taste of the World	2013	History
A Taste of the World	2013	News
A Teia	2014	Action
A Teia	2014	Crime
A Teia	2014	Thriller
A Tell Tale Vlog	2013	Comedy
A Tempo	2004	Music
A Terra Prometida	2016	Drama
A Terra dos Meninos Pelados	2003	Drama
A Terra dos Meninos Pelados	2003	Musical
A Thing Called Love	2004	Drama
A Thing Called Love	2004	Romance
A Thousand Apologies	2008	Comedy
A Thousand Million Million Ants	1985	Documentary
A Thousand Skies	1985	Adventure
A Thousand Skies	1985	Biography
A Thousand Skies	1985	Drama
A Thousand Skies	1985	History
A Thousand Skies	1985	Romance
A Time of AIDS	1993	Documentary
A Time of Day	1957	Thriller
A Time to Dance	1992	Drama
A Time to Live	1954	Drama
A Toca	2013	Comedy
A Todo Mecate con Alex y Pekas	2012	Comedy
A Totally Serious Series	2014	Comedy
A Touch Away	2006	Drama
A Touch of Cloth	2012	Action
A Touch of Cloth	2012	Comedy
A Touch of Cloth	2012	Crime
A Touch of Cloth	2012	Mystery
A Touch of Frost	1992	Crime
A Touch of Frost	1992	Drama
A Touch of Frost	1992	Mystery
A Touch of Grace	1973	Comedy
A Touch of Spice	1989	Comedy
A Touch of Venus	1968	Drama
A Touch of the Norman Vaughans	1964	Comedy
A Touch of the Norman Vaughans	1964	Music
A Town Called Stonehenge	2016	Horror
A Town Like Alice	1981	Drama
A Town Like Alice	1981	Romance
A Town Like Alice	1981	War
A Travel Guide to Life	2014	Family
A Tribo dos Penas Brancas	1987	Adventure
A Turbulent Affair	2015	Comedy
A Turma do Didi	1998	Comedy
A Tutto Tino	2014	Family
A Twist in the Tale	1998	Family
A Vaga	2014	Sport
A Velhinha que Fuma	2015	Comedy
A Very British Coup	1988	Drama
A Very British Murder with Lucy Worsley	2013	Documentary
A Very Peculiar Practice	1986	Comedy
A Very Peculiar Practice	1986	Drama
A Vez e a Voz	1984	Music
A Vida Alheia	2010	Comedy
A Vida Privada de Salazar	2009	History
A Vida Privada de Salazar	2009	Romance
A Vida com Eliane	1957	Comedy
A Vida da Gente	2011	Drama
A Vida da Gente	2011	Romance
A Vida de Rafinha Bastos	2013	Comedy
A Vida o de Lucas Batista	2013	Comedy
A Vida o de Lucas Batista	2013	Romance
A View of the Islands	1971	Family
A Visual Guide to the Universe with the Smithsonian	2014	Documentary
A Vodka Movie	2008	Comedy
A Vodka Movie	2008	Short
A Vote for the Stars	1964	Documentary
A Voz de Portugal	2011	Music
A War Diary	2001	Drama
A War Diary	2001	War
A Wealth of Wisdom	2004	News
A Wedding Story	1996	Documentary
A Week of It	1977	Comedy
A Whole New Ballgame	1995	Comedy
A Whole Scene Going	1966	Music
A Wide Stance	2008	Documentary
A Wider World	2001	Biography
A Wife for William	2004	Comedy
A Wife for William	2004	Documentary
A Will of Their Own	1998	Drama
A Will to Survive	2016	Documentary
A Window Looking In	2010	Documentary
A Winter Harvest	1984	Drama
A Winter Rose	2014	Drama
A Woman Called Moses	1978	Biography
A Woman Called Moses	1978	Drama
A Woman Named Jackie	1991	Biography
A Woman Named Jackie	1991	Drama
A Woman of Independent Means	1995	Drama
A Woman of Substance	1984	Drama
A Woman of Substance	1984	Romance
A Word from Our Sponsors	2011	Comedy
A Word in your Era	1992	Comedy
A Word with Alf	1997	Comedy
A World Apart	1969	Drama
A World in Arms	2003	Drama
A World of Comedy	1965	Comedy
A World of Comedy	1965	Family
A World of Dance in Philadelphia	2011	Documentary
A World of Her PWN	2008	Comedy
A World of Women	2015	Documentary
A World of Wonders	2007	Family
A Year at Kew	2004	Documentary
A Year at the Top	1977	Comedy
A Year in Provence	1993	Drama
A Year in Space	2015	Documentary
A Year in Tibet	2008	Documentary
A Year in Tuscany	2003	Documentary
A Year in the Life	1987	Drama
A Year in the Wild	2012	Documentary
A Year of Living Stupidly	2014	Comedy
A Year to Remember	1991	Documentary
A Year to Remember	1991	News
A Year with Fred	1987	Documentary
A caixa negra	2009	Documentary
A carte scoperte	1974	Documentary
A escena	2002	Biography
A escena	2002	Documentary
A escena	2009	News
A familia Pita	1996	Comedy
A flor de piel	1994	Drama
A flor de piel	1994	Romance
A floricultura da nana	2009	Family
A for Andromeda	1961	Drama
A grande richiesta	1981	History
A kaito	1998	Action
A kaito	1998	Animation
A kaito	1998	Crime
A kaito	1998	Drama
A kaito	1998	Thriller
A la Mexicana	1997	Comedy
A la cachi cachi porra	1992	Family
A la cama con Moria	1990	Comedy
A la caza del tesoro	1984	Adventure
A la recherche de Josephine	2013	Documentary
A la romana	2007	History
A la suerte de la olla	2001	Comedy
A la vuelta de la esquina	2003	Documentary
A las diez en mi barrio	1956	Comedy
A las once en casa	1998	Comedy
A media tarde	1985	Family
A media voz	1964	Family
A media voz	1987	Musical
A mi manera	2016	Music
A oscuras pero encendidos	1995	Comedy
A que no me dejas	2015	Drama
A quien corresponda	1990	News
A sada Zijah	2004	Comedy
A spas per la Ladinia	2012	Documentary
A su aire	1974	Music
A su servicio	1994	Comedy
A szerelem	1969	Drama
A tenger	1982	Drama
A tiro de piedra	2005	Documentary
A to Z	2014	Comedy
A to Z	2014	Romance
A toda plana	1965	Documentary
A toda plana	1965	News
A todo dar	1998	Drama
A todo ritmo	1971	Musical
A tope	1987	Music
A tortas con la vida	2005	Comedy
A tutto gag	1980	Comedy
A tutto gag	1980	Musical
A un	1980	Comedy
A un	1980	Drama
A vida por diante	2006	Drama
A votre service	2015	Comedy
A ze parea	1994	Comedy
A ze parea	1994	Romance
A zori zdes tikhie	2005	Drama
A zori zdes tikhie	2005	War
AA System Life	2012	Drama
ABC Afterschool Specials	1972	Adventure
ABC Afterschool Specials	1972	Comedy
ABC Afterschool Specials	1972	Drama
ABC Afterschool Specials	1972	Family
ABC Album	1953	Drama
ABC Bakery	2005	Family
ABC Barn Dance	1949	Music
ABC Comedy News	1973	Comedy
ABC Evening News	1953	News
ABC Minute Magazine	1977	News
ABC News Breakfast	2008	News
ABC News Nightline	1980	News
ABC News Report	1991	News
ABC News Reports	1963	Documentary
ABC News Reports	1963	News
ABC News	1986	News
ABC Notebook	1985	News
ABC Nutrition Spots	1977	Animation
ABC Rocks	1984	Music
ABC Saturday Comedy Special	1976	Comedy
ABC Scope	1964	Documentary
ABC Scope	1964	News
ABC Showcase	1950	Comedy
ABC Showcase	1950	Drama
ABC Sports College Football	1999	Sport
ABC TGIF	1990	Comedy
ABC Television Players	1949	Drama
ABC Weekend News	1968	News
ABC Weekend Specials	1977	Adventure
ABC Weekend Specials	1977	Animation
ABC Weekend Specials	1977	Comedy
ABC Weekend Specials	1977	Drama
ABC Weekend Specials	1977	Family
ABC Weekend Specials	1977	Fantasy
ABC Weekend Specials	1977	Romance
ABC World News This Morning	1982	News
ABC der Liebe	1974	Musical
ABC discapacidad	1999	Documentary
ABC in Concert Country	1994	Documentary
ABC in Concert Country	1994	Music
ABC in Concert	1991	Documentary
ABC in Concert	1991	Music
ABCD Nuls	1989	Comedy
ABCD ekologie aneb Zivotabudic	2001	Documentary
ABCs of Rock	2005	Music
ABFF Independent	2012	Short
ABGala	2014	Documentary
ACC Gridiron Live	2014	Sport
ACF	2012	Comedy
ACME Hollywood Dream Role	2011	Comedy
ACME Saturday Night	2009	Comedy
AD Bugi	1991	Drama
AD Police Files	1990	Animation
AD Police Files	1990	Crime
AD Police Files	1990	Short
AD Police Files	1990	Thriller
ADN Boricua	2014	History
AFF Suzuki Cup	2012	Sport
AFF Suzuki Cup	2014	Sport
AFK Show	2010	News
AFL Game Day	2008	Sport
AFL Insider	2010	Sport
AGG Toons	2010	Comedy
AHL Weekly	1993	Sport
AJPW Samurai TV	2002	Sport
AJW Samurai TV	2002	Sport
AKA Shaman	2011	Drama
ALF Tales	1988	Animation
ALF Tales	1988	Comedy
ALF	1986	Comedy
ALF	1986	Drama
ALF	1986	Family
AM Scuttlebutt	2003	Family
AMA United States Motocross Nationals	1990	Sport
AMC Family Classics	1996	Family
AMC Salutes the States	1989	Documentary
AMTV on D	2004	Family
AMV Heaven	2008	Comedy
ANiMASHUPS	2013	Animation
ANiMASHUPS	2013	Comedy
AOL Sessions	2002	Music
AOL Travel	2010	Adventure
AP Life	2014	Comedy
APBA Offshore Nationals	2004	Sport
ARCA Live on Fox Sports	2015	Sport
ARCiTEX	2015	Comedy
ARD Buffet	1998	Documentary
ARD Buffet	1998	News
ARD Wunschkonzert	1984	Music
ARGE Talkshow	2011	Comedy
ARSD Roller Derby	2012	Sport
ARTE Junior Magazin	2014	Family
ARTE Junior Magazin	2014	News
ASA Action Sports World Tour	1999	Sport
ASA Mobile Skatepark Series	2001	Sport
ASA Pro Tour	1999	Sport
ASAP Rocks	2011	Music
ASIA Exposed	2010	Documentary
ASPIREist	2016	Documentary
ASS Apartment Sketch Show	2011	Comedy
ATL TV	2004	Music
ATORmentados	2014	Comedy
ATP World Tour Uncovered	2015	Sport
ATV Illustrated	2007	Sport
ATV Kosmos	2012	Documentary
